Name,Subject,Level,Description,Concepts,URL
Early American Art,,,"Study and create various works, both realistic and abstract, including sketches, masks, architectural models, prints, and paintings",,https://www.k12.com/elementary-school-courses.html#elementary-school/course-details/5b562e1914cfe87791f0ba9b/
Early American Art,,,"Create artworks inspired by works they learn about, using many materials and techniques—after studying John James Audubon's extraordinary paintings of birds, students make bird paintings with realistic color and texture, and they make weavings inspired by the colors and patterns of Navajo blankets.",,https://www.k12.com/elementary-school-courses.html#elementary-school/course-details/5b562e1914cfe87791f0ba9b/
Language Arts,,,"Literature and Comprehension: Read aloud instruction coupled with plenty of literature kindles the imagination while building comprehension and vocabulary. The emphasis is on classic literature—fairy tales, fables, and folktales—including many works that embody exemplary virtues. ",,https://www.k12.com/elementary-school-courses.html#elementary-school/course-details/5e73cb74cd07fe0015c3731a/
English,,,"Literature and Comprehension: Read aloud instruction coupled with plenty of literature kindles the imagination while building comprehension and vocabulary. The emphasis is on classic literature—fairy tales, fables, and folktales—including many works that embody exemplary virtues. ",,https://www.k12.com/elementary-school-courses.html#elementary-school/course-details/5e73cb74cd07fe0015c3731a/
Language Arts,,,"Language Skills: Traditional poems, nursery rhymes, and riddles help students develop comprehension, vocabulary, and a love of language. Offline vocabulary instruction is accompanied by online review and practice. All About Me lays the foundations of the writing process as students brainstorm, discuss, illustrate, write, and share ideas with others. ",,https://www.k12.com/elementary-school-courses.html#elementary-school/course-details/5e73cb74cd07fe0015c3731a/
Physical Education,,,Young students need to learn the basics about how their bodies grow and work. They also need to learn about how to stay safe when crossing a street. The Summit PE K-2 program is designed to engage your student in activities that teach them how to live a healthy and safe life. Each lesson provides instructions and a material list for completing the acitivites,,https://www.k12.com/elementary-school-courses.html#elementary-school/course-details/5e7520f6d5967f00153c2d00/
Health,,,"It is important for children learn about all aspects of their health. The Summit Health 5 program teaches students about how their bodies work and grow and how to live a healthy active lifestyle. They will also learn how to stay safe, how to handle emergencies, and about diseases, medicines, and unhealthy substances. ",,https://www.k12.com/elementary-school-courses.html#elementary-school/course-details/5e752e86c143600015ad18e8/
History,,,"
The kindergarten Social Studies program teaches topics such as the meaning of national holidays, how people earn and use money, and ways students can help keep the country clean. By the end of the course, students will have a better understanding about what it means to live in the United States.",,https://www.k12.com/elementary-school-courses.html#elementary-school/course-details/5e750fe62f4e3c0017bb3911/
History 3,,,"Explore the Renaissance, and meet Petrarch, da Vinci, Michelangelo, Gutenberg, Galileo, and more.",,https://www.k12.com/elementary-school-courses.html#elementary-school/course-details/5b562b1fb809da2a85d46877/
Early American History,,,"The first half of a detailed two-year survey of the history of the United States, this course takes students from the arrival of the first people in North America through the Civil War and Reconstruction. Lessons integrate topics in geography, civics, and economics. Building on the award-winning series A History of US, the course guides students through critical episodes in the story of America. Students investigate Native American civilizations; follow the path of European exploration and colonization; assess the causes and consequences of the American Revolution; examine the Constitution and the growth of the new nation; and analyze what led to the Civil War and its aftermath.",,https://www.k12.com/elementary-school-courses.html#elementary-school/course-details/5b562b7e901bda570f6b3532/
History 4,,,"
The Summit Social Studies 4 program teaches the main branches of the United States government and how the branches work together to make and enforce laws. In this course, students will examine some documents that defined the nation and explore resources that they can use to learn more about the nation’s history. This course will also help students understand how businesses and banks work and that the government collects taxes to pay for services such as libraries and police.",,https://www.k12.com/elementary-school-courses.html#elementary-school/course-details/5e75150bceac160015933cd8/
Math 5,,,"focuses on expanding understanding of operations with fractions, developing a greater fluency with operations with multi-digit numbers, expanding understanding of decimals, and learning to perform operations with decimals, learning about the coordinate plane, and exploring volume.",,https://www.k12.com/elementary-school-courses.html#elementary-school/course-details/5cbb1d5ac8e7032cbb9555da/
Math 3,,,"focuses on reviewing patterns and number sense; discovering addition, subtraction, multiplication, and division strategies; exploring shapes and calculating area; learning about fractions and equivalent fractions; measuring time, length, liquid volume, and mass; and exploring and making data displays.",,https://www.k12.com/elementary-school-courses.html#elementary-school/course-details/5e73deaf04c8680015c93c5b/
Math 4,,,"focuses on expanding understanding of operations with whole numbers, developing a greater understanding of fractions, discovering decimals and their relationship to fractions, and exploring geometric figures.",,https://www.k12.com/elementary-school-courses.html#elementary-school/course-details/5cbb0c69023fe32b43335157/
Music,,,"This hands-on music course offers a variety of learning activities that include singing, dancing, virtual instruments, listening maps, authentic sound recordings with famous past and present artists, a player that allows students to customize key signatures, tempo, and lyrical highlighting, and playing the recorder. Six units in the course are organized into three sections: Spotlight on Concepts, Spotlight on Music Reading, and Spotlight on Celebrations. Students learn about these musical elements: duration, pitch, design, tone color, expressive qualities and cultural context, while exploring music from all over the world. Students also learn to read music and explore beat, meter, rhythm, melody, harmony, tonality, texture, form, tone color, dynamics, tempo, articulation, style, and music background.  Students apply the music skills they are learning while performing seasonal and celebratory songs.",,https://www.k12.com/elementary-school-courses.html#elementary-school/course-details/5b563183dec38c76d235b186/
Science 3,,,"Students learn to observe and analyze through hands-on experiments, and gain further insight into how scientists understand our world. They observe and chart the phases of the moon, determine the properties of insulators and conductors, and make a three-dimensional model of a bone.",,https://www.k12.com/elementary-school-courses.html#elementary-school/course-details/5e751dd62f518a001526a1cf/
Science 4,,,"Students develop scientific reasoning and perform hands on experiments in Earth, Life, and Physical Sciences. They construct an electromagnet, identify minerals according to their properties, use chromatography to separate liquids, and assemble food webs.",,https://www.k12.com/elementary-school-courses.html#elementary-school/course-details/5b5629fcd2e0db2c6f72da36/
Science 5,,,"Students perform experiments, develop scientific reasoning, and recognize science in the world around them. They build a model of a watershed, test how cell membranes function, track a hurricane, and analyze the effects gravity.",,https://www.k12.com/elementary-school-courses.html#elementary-school/course-details/5e751ffcc143600015ace3e1/
Beginning French,,,"This introductory French course provides a fun, interactive experience for a student’s first exposure to the French language. The content for each unit is based on an authentic story from the French-speaking world. This course, designed specifically for younger students, focuses principally on vocabulary acquisition through stories, games, songs, and practice activities. Students are exposed to the French language and French-speaking cultures in a fun environment where they can explore meanings and begin to express themselves through simple words and phrases.",,https://www.k12.com/elementary-school-courses.html#elementary-school/course-details/5b56344cfe3b552a95e241fb/
Foreign language,,,"This introductory Spanish course provides a fun, interactive experience for a student’s first exposure to the Spanish language. The content for each unit is based on an authentic story, myth or legend from the Spanish-speaking culture. This course, designed specifically for younger students, focuses principally on vocabulary acquisition through stories, games, songs, and practice activities. Students are exposed to Spanish language and Spanish-speaking cultures in a fun environment where they can explore meanings and begin to express themselves through simple words and phrases.",,https://www.k12.com/elementary-school-courses.html#elementary-school/course-details/5b563395d2e0db2c6f72f886/
Scientist,,,"You've probably heard of scientists, but what do they do? Well, scientists are people who love figuring out why things happen. You could be a scientist, too! Keep reading to learn more about scientists and how they perform their work.",,https://study.com/academy/lesson/what-does-a-scientist-do-lesson-for-kids.html
Science Terms for Kids,,,"In this lesson, you will learn the meaning of science and three important words that go with it. Understanding what science is and how these three words are used can help you become a better science student.",,https://study.com/academy/lesson/science-terms-for-kids.html
Scientific Method Lesson for Kids: Definition & Examples,,,"What is science? You might think of experiments and mixing chemicals. Science is way more than that, though. In this lesson, we will talk about the scientific method. Then, we will look at a few examples of it in action.",,https://study.com/academy/lesson/scientific-method-lesson-for-kids-definition-examples.html
Hypothesis Lesson for Kids: Definition & Examples,,,"Doing science experiments can be fun! But before you start your experiment, you need to make a hypothesis. In this lesson, you'll read about an experiment about mold growing on food. You'll also learn what a hypothesis is and how you can make one.",,https://study.com/academy/lesson/hypothesis-lesson-for-kids-definition-examples.html
Cause & Effect Lesson for Kids: Definition & Examples,,,"Cause and effect are everywhere, including science. Come and learn about the definitions of cause and effect, as well as some examples within the real world and scientific texts.",,https://study.com/academy/lesson/cause-effect-lesson-for-kids-definition-examples.html
Deductive Reasoning Lesson for Kids,,,Reasoning is a good way to convince someone to do something. There are two basic kinds of reasoning deductive and inductive. In this lesson we're going to look at deductive reasoning and how it can help you win an argument and be a better scientist.,,https://study.com/academy/lesson/deductive-reasoning-lesson-for-kids.html
Units of Measurement Lesson for Kids,,,"Have you ever used a ruler? Or stepped on a scale to see your weight? If so, you have measured something before! This lesson will talk about units of measurement and give the most common units for each measurement system we use.",,https://study.com/academy/lesson/units-of-measurement-lesson-for-kids.html
What is a Graph? - Lesson for Kids,,,"Graphs come in many different shapes and sizes. In this lesson, you'll discover what a graph is, how it represents information, and some of the awesome types available.",,https://study.com/academy/lesson/what-is-a-graph-lesson-for-kids.html
What is Volume in Science? - Lesson for Kids,,,"You may know of the many ways to talk about an object, from how tall it is to what color it is. But did you know that there's another way to describe an object? In this lesson, we will talk about volume.",,https://study.com/academy/lesson/what-is-volume-in-science-lesson-for-kids.html
Types of Scientists: Lesson for Kids,,,"The world is full of many wonders, and scientists explore and investigate everything around us. In this lesson, we will learn about different types of scientists who work to help us understand the mysteries of our world.",,https://study.com/academy/lesson/types-of-scientists-lesson-for-kids.html
Scientific Method Lesson for Kids: Steps & Process,,,Scientists use the scientific method to help them make sure their work is done the right way. But how does the method actually work? This lesson explains the scientific method's steps and processes.,,https://study.com/academy/lesson/scientific-method-lesson-for-kids-steps-process.html
Variables in Science Lesson for Kids,,,"Did you know science has its own language? Variables play a very important role in scientific experiments. In this lesson, learn what variables are, the different types of variables, and how they interact.",,"Did you know science has its own language? Variables play a very important role in scientific experiments. In this lesson, learn what variables are, the different types of variables, and how they interact."
Measurement Lesson for Kids,,,It would be hard to imagine a world where you didn't know if you were going too slow or too fast or if you were tall or short. You will learn what measurement is and how to measure things in this lesson.,,https://study.com/academy/lesson/measurement-lesson-for-kids.html
Measurement Conversions Lesson for Kids,,,"In this lesson, learn how to convert measurement units so no one can trick you when you go buy your favorite soda. Discover the basic rule for conversion and how to convert weight, length and volume units.",,https://study.com/academy/lesson/measurement-conversions-lesson-for-kids.html
The Golden Ratio Lesson for Kids,,,"The golden ratio is a special number that is used in many subjects, such as math and art. In this lesson, you will learn about the golden ratio and what it has been used for.",,https://study.com/academy/lesson/the-golden-ratio-lesson-for-kids.html
Electricity Safety Lesson for Kids,,,"In this lesson, you will learn why it is important to be safe around electricity. You will also learn ways to use electricity safely and what to do in case of emergencies.",,https://study.com/academy/lesson/electricity-safety-lesson-for-kids.html
Home Safety Lesson for Kids: Tips & Checklist,,,"One of the most important things in our lives is where we live. In this lesson, we will discuss some home safety tips that will help you keep you and your family safe. At the end is a handy checklist to help you make home safety easy!",,https://study.com/academy/lesson/home-safety-lesson-for-kids-tips-checklist.html
Cell Cycle Lesson for Kids,,,"Have you ever wondered how your body repairs itself when you get injured or how exactly you grow taller? During a process called mitosis, the building blocks of your body divide in order to keep you healthy and help you grow. Read on to learn more about what happens.",,https://study.com/academy/lesson/cell-cycle-lesson-for-kids.html
Bone Cells Lesson for Kids,,,"Your bones may look boring, but they are active, living body parts that are constantly being built up and broken down. Read on to learn about the three main types of bone cells: osteoclasts, osteoblasts, and osteocytes.",,https://study.com/academy/lesson/bone-cells-lesson-for-kids.html
Astronaut Food Lesson for Kids,,,How do you salt your food in space? That's one of the many fun questions answered in this lesson on astronaut food. Read on to learn what astronauts eat and how they prepare their meals.,,https://study.com/academy/lesson/astronaut-food-lesson-for-kids.html
Astronomy Lesson for Kids: Definition & Facts,,,"When the moon is full and bright in the night sky it might seem pretty close, but it is actually more than 200,000 miles away from the Earth's surface. In this lesson, learn what astronomy is, what astronomers study and more facts about our universe.",,https://study.com/academy/lesson/astronomy-lesson-for-kids-definition-facts.html
Telescopes Lesson for Kids: Definition & Facts,,,"Have you ever looked up at the night sky and wished you could see the moon up close? A telescope could help you with that! Learn about different types of telescopes, their history and some of the most famous telescopes in the world.",,https://study.com/academy/lesson/telescopes-lesson-for-kids-definition-facts.html
Animal Science Lesson for Kids,,,Did you eat eggs for breakfast or have a cold glass of milk with lunch? Humans rely on animals for food and much more. Animal scientists make sure these animals are happy and healthy. Let's learn all about animal science!,,https://study.com/academy/lesson/animal-science-lesson-for-kids.html
What is Science? - Lesson for Kids,,,"When you hear the word 'science', you might just think of all the information in your science textbook. But science is more than just facts; it is a system. Learn what science is and how it can be used to find out about how the world works in this lesson.",,https://study.com/academy/lesson/what-is-science-lesson-for-kids.html
Geology Lesson for Kids: Definition & Facts,,,"You've probably held a rock in your hand, but did you ever think about how that rock came to be and how it may have changed over time? Rocks contain many clues that tell scientists who study geology about planet Earth. Learn about geology in this fun lesson!",,https://study.com/academy/lesson/geology-lesson-for-kids-definition-facts.html
Types of Landforms: Lesson for Kids,,,"From a tall mountain to a low plain, the earth has many different and interesting types of landforms. Let's learn about some of the most common ones in this lesson on landforms.",,https://study.com/academy/lesson/types-of-landforms-lesson-for-kids.html
Rainforest Layers: Lesson for Kids,,,"Hidden inside the layers of the rainforest is a unique world of life. In today's lesson, you'll learn about the layers of the rainforest and the plant and animal life that call it home.",,https://study.com/academy/lesson/rainforest-layers-lesson-for-kids.html
Layers of the Earth: Lesson for Kids,,,"Although the earth might look like a solid ball, it's actually made up of several layers. This lesson teaches you some cool facts about the layers of the earth. We'll start with the outer crust and dig deep down to the core, all while exploring the layers in between.",,https://study.com/academy/lesson/layers-of-the-earth-lesson-for-kids.html
Sea Level Lesson for Kids: Definition & Facts,,,"In this lesson, you will learn about sea level and how it is measured by scientists. We will also explore rising sea levels and what long-term effects global warming has on them.",,https://study.com/academy/lesson/sea-level-lesson-for-kids-definition-facts.html
Plateau Lesson for Kids: Definition & Facts,,,"Plateaus are unique landforms found on all continents. In this lesson, learn the definition of a plateau, find out how plateaus are formed, and discover major plateaus of the world.",,https://study.com/academy/lesson/plateau-lesson-for-kids-definition-facts.html
Parts of a Volcano: Lesson for Kids,,,"Volcanoes are found all over the world, and they are impressive landforms! In this lesson, learn about the parts of a volcano including their characteristics and how they function.",,https://study.com/academy/lesson/parts-of-a-volcano-lesson-for-kids.html
Fossils for Elementary School,,,"How do scientist know so much about dinosaurs and other animals who lived long ago? By studying the fossils they left behind. In this lesson, we will investigate fossils, see two basic types of fossils, and explore the process of how they form.",,https://study.com/academy/topic/fossils-for-elementary-school.html
Temperature Definition: Lesson for Kids,,,"Whether it's a bite of hot soup, the cool waters of the ocean, or a fever when we are sick, temperature is a part of our everyday lives. In this lesson, you'll learn all about temperature.",,https://study.com/academy/lesson/temperature-definition-lesson-for-kids.html
Rainbow Colors: Lesson for Kids,,,"We see rainbows when light reflects off water droplets in the air. Come learn about the colors of the rainbow, why they usually appear in the same order and some other cool facts about these colorful bands of light.",,https://study.com/academy/lesson/rainbow-colors-lesson-for-kids.html
Cyclones Lesson for Kids: Facts & Causes,,,"Cyclones are storms with swirling clouds, powerful winds, and strong rains that start in the ocean. You have probably never lived through a cyclone because you will usually be warned about them. Learn about cyclones and how they form.",,https://study.com/academy/lesson/cyclones-lesson-for-kids-facts-causes.html
Hurricane Sandy Lesson for Kids,,,Hurricane Sandy was a tropical cyclone that affected seven countries and killed an estimated 285 people. This lesson will cover the facts about this dangerous storm from 2012.,,https://study.com/academy/lesson/hurricane-sandy-lesson-for-kids.html
What Causes a Tsunami? - Lesson for Kids,,,"Imagine a wall of water hundreds of feet high and traveling as fast as an airplane! This sounds like something impossible and imaginary, but waves like these are very real and very scary. This lesson will explain how tsunamis are formed.",,https://study.com/academy/lesson/what-causes-a-tsunami-lesson-for-kids.html
Wildfire Lesson for Kids: Definition & Facts,,,"Wildfires burn hundreds of thousands of acres of land every year. This lesson describes what a wildfire is, what causes them, and how firefighters work to put them out.",,https://study.com/academy/lesson/wildfire-lesson-for-kids-definition-facts.html
Tornado Alley Facts: Lesson for Kids,,,Tornadoes can be a scary weather event! Did you know that some parts of the United States are more prone to getting them? Let's learn more about this place called Tornado Alley!,,https://study.com/academy/lesson/tornado-alley-facts-lesson-for-kids.html
Typhoon Facts: Lesson for Kids,,,"Typhoons are very large storms that occur in ocean waters. In this lesson, learn how a typhoon forms, identify the similarities and differences between typhoons and hurricanes, and find out about some of the damages typhoons can cause.",,https://study.com/academy/lesson/typhoon-facts-lesson-for-kids.html
Water Facts: Lesson for Kids,,,"We certainly can't live without it. None of us can. Water is the most basic part of life, and we all need it to survive. This lesson will teach you everything you need to know about water.",,https://study.com/academy/lesson/water-facts-lesson-for-kids.html
Volcano Cycle: Lesson for Kids,,,"Like many things in nature, volcanoes go through cycles. A volcanic cycle is unique because it can take thousands of years to complete. Here, you will learn about the three stages of a volcano's life cycle.",,https://study.com/academy/lesson/volcano-cycle-lesson-for-kids.html
Ecosphere Lesson for Kids,,,"Have you ever wondered why living things cannot survive on other planets, but they can on Earth? It is because of Earth's ecosphere. In this lesson you'll learn what an ecosphere is, how it works, and how it supports life.",,https://study.com/academy/lesson/ecosphere-lesson-for-kids.html
Biosphere Lesson for Kids: Definition & Facts,,,What do you and I have in common with a giant squid? We all call the biosphere home! Learn what the biosphere is and discover fascinating facts about the biosphere in this lesson.,,https://study.com/academy/lesson/biosphere-lesson-for-kids-definition-facts.html
Lesson for Kids: What is a Landmark? - Definition & Facts,,,"There are landmarks across the world that hold great importance. In this lesson, you will learn about what a landmark is and facts about some of the most well-known landmarks in the United States and other countries.",,https://study.com/academy/lesson/lesson-for-kids-what-is-a-landmark-definition-facts.html
Types of Mountains: Lesson for Kids,,,"In this lesson, you will learn about different types of mountains. We will explore how these mountains form, and where they can be found in the world.",,https://study.com/academy/lesson/types-of-mountains-lesson-for-kids.html
Adaptations for Kids,,,"Our Adaptations for Kids course is designed to help elementary students learn via a fun online environment. The course's engaging lessons and practice quizzes can help any elementary-level student study for tests, finish homework assignments and improve their science knowledge. ",,https://study.com/academy/course/adaptations-for-kids.html
Life Science for Kids,,,"This engaging online course makes studying the basics of life science fun. Help young students prepare for a test, understand an assignment or complete a project focused on life science by presenting them with a variety of bite-sized lessons, brief quizzes and practice exams. ",,https://study.com/academy/course/life-science-for-kids.html
